{
  "id": "kyoto-7gg",
  "title": "Kyoto e i suoi templi",
  "country": "Giappone",
  "continent": "Asia",
  "coverUrl": "https://images.unsplash.com/photo-1493976040374-85c8e12f0c0e?w=800&q=80",
  "description": "Immergiti nella cultura giapponese con un tour dei templi più iconici di Kyoto, dai giardini di zen ai santuari shintoisti.",
  "duration": 7,
  "difficulty": "facile",
  "budget": "alto",
  "bestPeriod": "Marzo-Aprile (ciliegi), Novembre (autunno)",
  "transport": "Treno locale, autobus, bicicletta",
  "tips": "Compra il bus pass giornaliero. Molti templi chiudono presto (16:30-17:00). Evita la bolle高峰期 di aprile e novembre.",
  "days": {
    "2025-10-01": {
      "place": "Kyoto",
      "activities": ["Arrivo e installazione", "Passeggiata a Gion", "Cena kaiseki"],
      "accommodation": "Ryokan nel quartiere Higashiyama",
      "categories": ["cultura", "cibo"],
      "image": "https://images.unsplash.com/photo-1478436127897-769e1b3f0f36?w=800&q=80"
    },
    "2025-10-02": {
      "place": "Kyoto",
      "activities": ["Kinkaku-ji (Padiglione d'Oro)", "Ryoan-ji", "Nijo Castle"],
      "accommodation": "Ryokan nel quartiere Higashiyama",
      "categories": ["cultura", "storia"],
      "image": "https://images.unsplash.com/photo-1579027989536-b7b1f875659b?w=800&q=80"
    },
    "2025-10-03": {
      "place": "Kyoto",
      "activities": ["Fushimi Inari (mille torii)", "Tofuku-ji", "Sake brewery tour"],
      "accommodation": "Ryokan nel quartiere Higashiyama",
      "categories": ["cultura", "natura"],
      "image": "https://images.unsplash.com/photo-1478436127897-769e1b3f0f36?w=800&q=80"
    },
    "2025-10-04": {
      "place": "Arashiyama",
      "activities": ["Bamboo Grove", "Tenryu-ji", "Monkey Park"],
      "accommodation": "Ryokan nel quartiere Higashiyama",
      "categories": ["natura", "cultura"],
      "image": "https://images.unsplash.com/photo-1545569341-9eb8b30979d9?w=800&q=80"
    },
    "2025-10-05": {
      "place": "Kyoto",
      "activities": ["Philosopher's Path", "Ginkaku-ji", "Nanzen-ji"],
      "accommodation": "Ryokan nel quartiere Higashiyama",
      "categories": ["natura", "cultura"],
      "image": "https://images.unsplash.com/photo-1493976040374-85c8e12f0c0e?w=800&q=80"
    },
    "2025-10-06": {
      "place": "Kyoto",
      "activities": ["Tea ceremony", "Shopping a Nishiki Market", "Cena yakitori"],
      "accommodation": "Ryokan nel quartiere Higashiyama",
      "categories": ["cultura", "cibo", "shopping"],
      "image": "https://images.unsplash.com/photo-1528360983277-13d401cdc186?w=800&q=80"
    },
    "2025-10-07": {
      "place": "Kyoto",
      "activities": ["Uji (tè matcha)", "Partenza"],
      "accommodation": "",
      "categories": ["cibo", "cultura"],
      "image": "https://images.unsplash.com/photo-1545569341-9eb8b30979d9?w=800&q=80"
    }
  },
  "extras": []
}
